{
  "descriptor_contract": {
    "name": "aletheia.research-control-plane-descriptor",
    "version": "0.1.0",
    "schema_version": "0.1.0"
  },
  "control_plane": {
    "id": "kidney-regeneration-research",
    "display_name": "SYNTHETIC/ILLUSTRATIVE CONTRACT INSTANCE — NOT A QUALIFIED KIDNEY INTEGRATION",
    "research_domain": "Synthetic kidney regeneration research illustration"
  },
  "repository": {
    "url": "https://github.com/bonushora/bonushora-kidney-regeneration-research.git",
    "branch": "main",
    "commit_sha": "30ecd32f4639949755a0062670389913129321b4"
  },
  "authority": {
    "research_only": true,
    "clinical_authority": false,
    "human_scientific_authority_required": true
  },
  "consumes": []
}
